S.No,Photo ID,User ID,Latitude,Longitude,Timestamp,Tags
1,30654573795,7771707@N08,19.128161,72.824935,2015-09-27 16:41:07,"mumbai, bus, india, street, indiastreet, crosswalk, southasia, bombay, gatewayofindia, maharashtrastate, olympusem10, mirrorless, mft, 17mmf18, primelens, victorianarchitecture, publictransport, microfourthirds, wanderlust, travel"
2,5706865168,8930636@N05,18.983895,72.818756,2011-02-22 08:47:25,"inde, travel, voyage, india, asie, asia, homme, portrait, couleur, photo, bombay, mumbai, canon, sikh, canonfrance, images, tourism, tourisme, lonely, géo, ©jmboyer, planet, face, culture, tradition, travelphotography, incredibleindia, indiatourism, gettyimages, flickr, photography, picture, turban, भारत, colorsofindia, yahoo, lonelyplanet, imagesgoogle, googleimage, viajes, canoneos, photogéo, nationalgeographie, photoflickr, ©jmboyer, photosgoogleearth, photosflickr, photosyahoo, nationalgeographic, retrato, photoyahoo"
3,7871161542,49503155635@N01,18.954864,72.811491,2012-08-22 19:35:42,"asia, bombay, canon5dmarkii, india, mumbai, southasia, travel, travelphotography, chowpatty, beach, chowpattybeach, men, muslim, islam, eid, eidulfitr, girgaumchaupati, chaupati, girgaumchowpatty, girgaum, arabiansea, canon50f14, canon5014, shalwarkameez, salwarkameez, youth, youths, gettyimages, gettyimagesonflickr, getty, flickrvision, flickreditorial, editorial, reportage, fromthearchives, archives, topv2222"
4,9646208523,28134801@N00,18.92902,72.829055,2011-05-19 11:44:22,"elviaje2011, asia, event, india, hampi, mumbai, travel"
5,9669245285,85362192@N05,19.07619,72.875877,2013-08-17 21:26:44,"bottles, streets, mumbai, india, canon550d, colours, eosrebelt2i, evening, indian, aesthetic, bottle, chilled, city, everyday, indianmarket, indianstreets, life, liquid, market, sip, streetphotography, street, thirst, travel, urban"
